{
  "$schema": "https://json-schema.org/draft/2020-12/schema",
  "title": "Portable travel planning draft v1",
  "type": "object",
  "properties": {
    "schema_version": {
      "const": 1
    },
    "mode": {
      "enum": [
        "brainstorm",
        "plan",
        "update"
      ]
    },
    "trip": {
      "type": "object",
      "properties": {
        "id": {
          "type": "string",
          "pattern": "^[a-zA-Z0-9][a-zA-Z0-9_-]{0,79}$",
          "maxLength": 80
        },
        "title": {
          "type": "string",
          "minLength": 1,
          "maxLength": 200
        },
        "home_time_zone": {
          "type": "string",
          "minLength": 1,
          "maxLength": 100
        },
        "window": {
          "oneOf": [
            {
              "type": "string",
              "minLength": 1,
              "maxLength": 200
            },
            {
              "type": "null"
            }
          ]
        },
        "start_date": {
          "oneOf": [
            {
              "type": "string",
              "pattern": "^\\d{4}-\\d{2}-\\d{2}$"
            },
            {
              "type": "null"
            }
          ]
        },
        "end_date": {
          "oneOf": [
            {
              "type": "string",
              "pattern": "^\\d{4}-\\d{2}-\\d{2}$"
            },
            {
              "type": "null"
            }
          ]
        },
        "notes": {
          "type": "array",
          "items": {
            "type": "string",
            "minLength": 1,
            "maxLength": 1000
          },
          "maxItems": 30
        }
      },
      "required": [
        "id",
        "title",
        "home_time_zone",
        "window",
        "start_date",
        "end_date",
        "notes"
      ],
      "additionalProperties": false
    },
    "sources": {
      "type": "array",
      "items": {
        "type": "object",
        "properties": {
          "id": {
            "type": "string",
            "pattern": "^[a-zA-Z0-9][a-zA-Z0-9_-]{0,79}$",
            "maxLength": 80
          },
          "label": {
            "type": "string",
            "minLength": 1,
            "maxLength": 200
          },
          "kind": {
            "enum": [
              "user",
              "supplier",
              "article",
              "other"
            ]
          },
          "checked_at": {
            "oneOf": [
              {
                "type": "string",
                "pattern": "^\\d{4}-\\d{2}-\\d{2}T\\d{2}:\\d{2}:\\d{2}Z$"
              },
              {
                "type": "null"
              }
            ]
          }
        },
        "required": [
          "id",
          "label",
          "kind",
          "checked_at"
        ],
        "additionalProperties": false
      },
      "maxItems": 200
    },
    "events": {
      "type": "array",
      "items": {
        "type": "object",
        "properties": {
          "id": {
            "type": "string",
            "pattern": "^[a-zA-Z0-9][a-zA-Z0-9_-]{0,79}$",
            "maxLength": 80
          },
          "title": {
            "type": "string",
            "minLength": 1,
            "maxLength": 200
          },
          "kind": {
            "enum": [
              "flight",
              "train",
              "stay",
              "transfer",
              "activity",
              "meal",
              "other"
            ]
          },
          "start": {
            "$ref": "#/$defs/time"
          },
          "end": {
            "$ref": "#/$defs/time"
          },
          "origin": {
            "oneOf": [
              {
                "type": "string",
                "minLength": 1,
                "maxLength": 200
              },
              {
                "type": "null"
              }
            ]
          },
          "destination": {
            "oneOf": [
              {
                "type": "string",
                "minLength": 1,
                "maxLength": 200
              },
              {
                "type": "null"
              }
            ]
          },
          "party_size": {
            "oneOf": [
              {
                "type": "integer",
                "minimum": 1,
                "maximum": 1000
              },
              {
                "type": "null"
              }
            ]
          },
          "booking": {
            "enum": [
              "idea",
              "not_booked",
              "held",
              "confirmed",
              "cancelled"
            ]
          },
          "payment": {
            "enum": [
              "unknown",
              "unpaid",
              "deposit",
              "paid",
              "refunded"
            ]
          },
          "completion": {
            "enum": [
              "unconfirmed",
              "completed",
              "cancelled"
            ]
          },
          "source_ids": {
            "type": "array",
            "items": {
              "type": "string",
              "pattern": "^[a-zA-Z0-9][a-zA-Z0-9_-]{0,79}$",
              "maxLength": 80
            },
            "maxItems": 200
          },
          "notes": {
            "type": "array",
            "items": {
              "type": "string",
              "minLength": 1,
              "maxLength": 1000
            },
            "maxItems": 30
          }
        },
        "required": [
          "id",
          "title",
          "kind",
          "start",
          "end",
          "origin",
          "destination",
          "party_size",
          "booking",
          "payment",
          "completion",
          "source_ids",
          "notes"
        ],
        "additionalProperties": false
      },
      "maxItems": 200
    },
    "candidates": {
      "type": "array",
      "items": {
        "type": "object",
        "properties": {
          "id": {
            "type": "string",
            "pattern": "^[a-zA-Z0-9][a-zA-Z0-9_-]{0,79}$",
            "maxLength": 80
          },
          "title": {
            "type": "string",
            "minLength": 1,
            "maxLength": 200
          },
          "area": {
            "oneOf": [
              {
                "type": "string",
                "minLength": 1,
                "maxLength": 200
              },
              {
                "type": "null"
              }
            ]
          },
          "timing": {
            "$ref": "#/$defs/time"
          },
          "status": {
            "enum": [
              "candidate",
              "selected",
              "rejected"
            ]
          },
          "verification": {
            "enum": [
              "source_only",
              "location_checked",
              "live_checked"
            ]
          },
          "source_ids": {
            "type": "array",
            "items": {
              "type": "string",
              "pattern": "^[a-zA-Z0-9][a-zA-Z0-9_-]{0,79}$",
              "maxLength": 80
            },
            "maxItems": 200
          },
          "notes": {
            "type": "array",
            "items": {
              "type": "string",
              "minLength": 1,
              "maxLength": 1000
            },
            "maxItems": 30
          }
        },
        "required": [
          "id",
          "title",
          "area",
          "timing",
          "status",
          "verification",
          "source_ids",
          "notes"
        ],
        "additionalProperties": false
      },
      "maxItems": 200
    },
    "evidence": {
      "type": "array",
      "items": {
        "type": "object",
        "properties": {
          "subject_id": {
            "type": "string",
            "pattern": "^[a-zA-Z0-9][a-zA-Z0-9_-]{0,79}$",
            "maxLength": 80
          },
          "field": {
            "type": "string",
            "minLength": 1,
            "maxLength": 100
          },
          "source_id": {
            "type": "string",
            "pattern": "^[a-zA-Z0-9][a-zA-Z0-9_-]{0,79}$",
            "maxLength": 80
          },
          "summary": {
            "type": "string",
            "minLength": 1,
            "maxLength": 1000
          }
        },
        "required": [
          "subject_id",
          "field",
          "source_id",
          "summary"
        ],
        "additionalProperties": false
      },
      "maxItems": 500
    },
    "questions": {
      "type": "array",
      "items": {
        "type": "string",
        "minLength": 1,
        "maxLength": 1000
      },
      "maxItems": 50
    },
    "change_summary": {
      "type": "array",
      "items": {
        "type": "string",
        "minLength": 1,
        "maxLength": 1000
      },
      "maxItems": 50
    }
  },
  "required": [
    "schema_version",
    "mode",
    "trip",
    "sources",
    "events",
    "candidates",
    "evidence",
    "questions",
    "change_summary"
  ],
  "additionalProperties": false,
  "$defs": {
    "time": {
      "oneOf": [
        {
          "type": "object",
          "properties": {
            "kind": {
              "const": "unknown"
            },
            "reason": {
              "type": "string",
              "minLength": 1,
              "maxLength": 1000
            }
          },
          "required": [
            "kind",
            "reason"
          ],
          "additionalProperties": false
        },
        {
          "type": "object",
          "properties": {
            "kind": {
              "const": "date"
            },
            "local_date": {
              "type": "string",
              "pattern": "^\\d{4}-\\d{2}-\\d{2}$"
            },
            "time_zone": {
              "type": "string",
              "minLength": 1,
              "maxLength": 100
            }
          },
          "required": [
            "kind",
            "local_date",
            "time_zone"
          ],
          "additionalProperties": false
        },
        {
          "type": "object",
          "properties": {
            "kind": {
              "const": "exact"
            },
            "local_datetime": {
              "type": "string",
              "pattern": "^\\d{4}-\\d{2}-\\d{2}T\\d{2}:\\d{2}$"
            },
            "time_zone": {
              "type": "string",
              "minLength": 1,
              "maxLength": 100
            },
            "instant": {
              "type": "string",
              "pattern": "^\\d{4}-\\d{2}-\\d{2}T\\d{2}:\\d{2}:\\d{2}Z$"
            }
          },
          "required": [
            "kind",
            "local_datetime",
            "time_zone",
            "instant"
          ],
          "additionalProperties": false
        }
      ]
    }
  }
}
